id,name,latitude,longitude,status,reliability,penalty,description
1,성동구청 흡연부스,37.563456,127.036821,0,90,0,구청사 뒤편 주차장 인근 공식 흡연부스
2,왕십리역 광장,37.561243,127.038456,1,0,100000,광장 전체 금연구역 (지하철 출입구 10m 이내)
3,서울숲 공원 입구,37.544521,127.037568,1,0,100000,도시공원법에 따른 금연구역
4,한양대학교 HIT관 옆,37.556214,127.045231,0,85,0,건물 우측 지정 흡연구역
5,성수역 3번 출구 뒤편,37.544569,127.055974,2,60,0,최근 공사로 인해 폐쇄되었다는 제보 있음 (확인 필요)
6,마장동 축산물시장 북문,37.569821,127.042315,0,85,0,시장 상인회 관리 구역
7,응봉산 팔각정,37.550123,127.031456,1,0,50000,산림보호법 위반 과태료 부과 대상
8,비트플렉스 1층 주차장,37.5615,127.0391,0,90,0,쇼핑몰 이용객을 위한 지정 공간
9,성수 카페거리 골목,37.542311,127.053123,2,45,0,민원 빈발로 인해 철거 논의 중 (신뢰도 낮음)
10,뚝섬유원지 잔디밭,37.531234,127.066789,1,0,100000,한강공원 내 지정 장소 외 금연
11,한양대 제1공학관 뒤,37.555123,127.04789,0,98,0,학생회관 방향 벤치 근처
12,한양대역 2번 출구,37.55589,127.043567,1,0,100000,지하철 출입구 금연 구역
13,사근동 주민센터 앞,37.560123,127.048901,0,80,0,주민센터 우측 자판기 옆
14,왕십리 도선동 상점가,37.565432,127.035678,2,55,0,최근 민원으로 재떨이 수거됨 (확인 필요)
15,상왕십리역 1번 출구 인근,37.564567,127.029876,1,0,100000,대로변 버스정류장 및 출구 금연
16,성동경찰서 옆 공터,37.562345,127.035123,0,88,0,경찰서 담벼락 외부 지정 구역
17,소월아트홀 옥상정원,37.56089,127.039567,1,0,50000,건물 전체 금연 구역 지정
18,한양여대 본관 뒤편,37.558765,127.050123,0,92,0,교직원 및 학생 공용 흡연실
19,응봉역 하부 쉼터,37.551234,127.034567,0,75,0,자전거 도로 인근 쉼터 (비공식)
20,서울숲 언더스탠드에비뉴,37.54321,127.042345,1,0,100000,문화예술공간 전체 금연
21,갤러리아포레 상가 뒤,37.545678,127.040123,0,85,0,상가 관리실 옆 지정 구역
22,성수동 구두테마공원,37.541234,127.054567,1,0,50000,공원 내 흡연 금지
23,성수 연무장길 입구,37.543567,127.056789,2,65,0,팝업스토어 행사로 임시 폐쇄 가능성 있음
24,LCDC 서울,37.54189,127.058901,0,90,0,건물 3층 테라스 흡연 부스
25,성수 이마트 본사 앞,37.539876,127.05321,0,95,0,직원 및 방문객 이용 구역
26,뚝섬역 5번 출구 골목,37.547654,127.046543,1,70,0,음식점 밀집 구역 뒤편
27,경동초등학교 통학로,37.540123,127.050987,1,0,100000,어린이 보호구역 절대 금연
28,성수고등학교 담벼락,37.546789,127.048765,1,0,100000,학교 환경 위생 정화 구역
29,금호역 1번 출구,37.548901,127.025432,1,0,100000,지하철역 출입구 금연
30,금남시장 입구,37.549876,127.022345,2,62,0,시장 입구 공터 (상인회 관리)
31,옥수역 7번 출구 하부,37.541234,127.01789,0,88,0,고가도로 하부 지정 공간
32,달맞이봉 공원,37.542345,127.020123,1,0,50000,산책로 전 구간 금연
33,응봉현대아파트 상가,37.552345,127.033456,0,78,0,상가 뒤편 주차장 구석
34,행당역 2번 출구,37.557654,127.029876,1,0,100000,지하철 출입구 금연
35,무학여고 정문,37.559876,127.032109,1,0,100000,학교 앞 절대 정화 구역
36,왕십리 뉴타운 센트라스,37.56789,127.025678,1,0,50000,아파트 단지 내 전체 금연
37,청계천 마장교 하부,37.571234,127.038901,2,60,0,침수 우려로 우천시 이용 불가
38,용답역 1번 출구,37.561234,127.051234,1,0,100000,역사 주변 금연 구역
39,서울새활용플라자,37.562345,127.058765,1,0,50000,환경 시설물로 전체 금연
40,송정동 제방길,37.553456,127.062345,1,0,50000,벚꽃길 산책로 금연
41,살곶이 체육공원,37.558901,127.053456,1,0,50000,체육시설 내 금연
42,한양대 에리카 학술정보관(오기),37.554321,127.046789,2,40,0,위치 데이터 오류 제보 많음 (폐쇄됨)
43,성동구민체육센터,37.542345,127.044567,1,0,50000,공공시설물 전체 금연
44,뚝섬 구길 상가거리,37.545678,127.048901,0,85,0,편의점 앞 파라솔 구역
45,성수동 지식산업센터(생각공장),37.548765,127.058901,0,95,0,1층 공개공지 흡연 부스
46,성수낙낙,37.546543,127.061234,0,90,0,건물 사이 지정 흡연 구역
47,화양사거리 인근,37.548901,127.065432,2,50,0,최근 건물주 요청으로 재떨이 철거됨
48,어린이대공원 후문(성동구경계),37.551234,127.071234,1,0,100000,공원 입구 및 주변 금연
49,송정동 주민센터,37.550987,127.060123,0,88,0,주차장 뒤편 지정 구역
50,마장역 2번 출구,37.566543,127.041234,1,0,100000,지하철 출입구 금연
51,성동구립도서관 벤치,37.559234,127.037123,1,0,50000,도서관 부지 내 전면 금연
52,왕십리 이마트 후문,37.562123,127.03789,0,95,0,직원 및 고객 겸용 흡연 부스
53,도선동 먹자골목 내부,37.564123,127.036123,2,55,0,민원 다발 구역으로 철거 위기 (보류)
54,무학봉 근린공원,37.558123,127.028901,1,0,50000,공원 내 야간 흡연 단속 강화
55,신금호역 3번 출구,37.554321,127.020123,1,0,100000,지하철 출입구 금연 (단속 CCTV)
56,금호동 벽산아파트 상가 뒤,37.552123,127.023456,0,80,0,상가 이용객을 위한 임시 구역
57,서울숲 리버뷰 자이 정문,37.556789,127.039876,1,0,50000,아파트 단지 입구 금연
58,성수동 수제화거리 입구,37.543456,127.055123,1,0,50000,관광객 밀집 구역 금연 권고
59,성수 에스팩토리 D동,37.54289,127.059123,0,90,0,건물 내 지정 흡연 부스 (2층)
60,화양사거리 고가 하부,37.547123,127.06789,2,65,0,비공식 흡연 구역 (환경 미화 필요)
61,송정 제방길 입구,37.55289,127.063456,1,0,50000,하천 산책로 진입로 금연
62,용답동 로데오거리,37.56289,127.049123,0,75,0,상점가 골목 내 암묵적 흡연 구역
63,한양대 제2의학관,37.557123,127.044123,0,95,0,건물 뒤편 공식 흡연 구역
64,사근동 하이츠 아파트,37.559456,127.046789,1,0,50000,단지 내 놀이터 주변 금연
65,청계천 박물관 앞,37.570123,127.041234,1,0,100000,박물관 및 하천 주변 금연
66,마장국민체육센터,37.568123,127.043456,1,0,50000,체육시설 주변 금연
67,성동세무서 뒤편,37.549123,127.063123,0,90,0,주차장 구석 지정 구역
68,경일중학교 담벼락,37.544123,127.043123,1,0,100000,학교 절대 정화 구역
69,성수역 1번 출구 에스컬레이터,37.545123,127.056123,1,0,100000,역사 진입로 완전 금연
70,성수동 대림창고 앞,37.541567,127.05589,1,0,0,인파 밀집으로 인한 금연 권장 구역
71,KT 성수지사 앞,37.540123,127.057123,0,85,0,사옥 외부 지정 공간
72,서울숲 코오롱디지털타워,37.543123,127.051123,0,95,0,건물 뒤편 흡연 부스 운영
73,성동교 남단 교차로,37.548123,127.042123,1,0,50000,교통섬 및 횡단보도 금연
74,응봉교 하부 체육시설,37.550456,127.036123,1,0,50000,운동기구 주변 금연
75,금호사거리 대로변,37.548567,127.026123,1,0,50000,버스정류장 10m 이내
76,옥수 리버젠 상가,37.54289,127.018123,1,70,0,상가 뒷길 (주민 민원 주의)
77,매봉산 등산로 입구,37.544123,127.016123,1,0,100000,산불 예방을 위한 절대 금연
78,서울중앙병원 장례식장,37.563123,127.021123,0,90,0,외부 지정 흡연 공간
79,왕십리역 6-1번 출구,37.560123,127.039123,1,0,100000,유동인구 많은 출구 앞 금연
80,성동소방서 차고지 옆,37.554123,127.038123,1,0,0,긴급차량 출동로 (절대 금연)
81,한국철도공사,37.553149,126.968881,0,100,0,서울특별시 용산구 서울역 광장 15번출구
82,한국철도공사,37.55376,126.969662,0,100,0,서울특별시 용산구 서울역 광장 1번출구
83,현대아이파크몰,37.528404,126.965569,0,100,0,서울특별시 용산구 용산역 광장
84,용산구청,37.532709,126.99,0,100,0,서울특별시 용산구 용산구청 옥상
85,용산구청,37.532709,126.99,0,100,0,서울특별시 용산구 용산구청 2층 외부
86,용산경찰서,37.541169,126.96765,0,100,0,서울특별시 용산구 용산경찰서 1층 외부
87,원효지구대 방법순찰대,37.538716,126.96589,0,100,0,서울특별시 용산구 원효지구대 방범순찰대(옛 용산구청)
88,서울지방보훈청,37.534923,126.974192,0,100,0,서울특별시 용산구 서울지방보훈청 실외
89,용산세무서,37.523302,126.96868,0,100,0,서울특별시 용산구 용산세무서 1층 외부
90,국방부,37.533237,126.97859,0,100,0,서울특별시 용산구 국방부 컨벤스 1층 외부
91,순천향대학교병원,37.534466,127.004585,0,100,0,서울특별시 용산구 순천향대학교 서울병원 장례식장 외부
92,순천향대학교병원,37.534009,127.004334,0,100,0,서울특별시 용산구 순천향대학교 서울병원 신관 옥상
93,하얏트호텔,37.539372,126.997264,0,100,0,서울특별시 용산구 1층 외부 주차장 가는길 휴식장소
94,현대아이파크몰,37.529492,126.964318,0,100,0,서울특별시 용산구 아이파크몰 달 주차장 4.5층
95,현대아이파크몰,37.529492,126.964318,0,100,0,서울특별시 용산구 아이파크몰 해 주차장 4.5층
96,현대아이파크몰,37.529492,126.964318,0,100,0,서울특별시 용산구 아이파크몰 8층 옥상
97,선인상가,37.533068,126.963521,0,100,0,서울특별시 용산구 선인상가 21동 1층 외부
98,선인상가,37.533068,126.963521,0,100,0,서울특별시 용산구 선인상가 21동 옥상
99,대주아이피아,37.533417,126.96736,0,100,0,서울특별시 용산구 1층 공유지
100,전자랜드,37.532818,126.958895,0,100,0,서울특별시 용산구 주차장 지하 1층
101,아모레퍼시픽,37.52911,126.968532,0,100,0,서울특별시 용산구 아모레퍼시픽 10층 테라스
102,제일기획,37.535103,126.998616,0,100,0,서울특별시 용산구 제일기획 1층 외부 주차장
103,제이엘레지던스,37.536678,126.961147,0,100,0,서울특별시 용산구 건물 옥상
104,충영빌딩,37.538329,126.959979,0,100,0,서울특별시 용산구 충영빌딩 옥상
105,G테크밸리,37.533234,126.957656,0,100,0,"서울특별시 용산구 e테크밸리 공개공지, 옥상"
106,삼원빌딩,37.534626,126.959002,0,100,0,서울특별시 용산구 삼원빌딩 옥상
107,대교빌딩,37.533918,126.95763,0,100,0,서울특별시 용산구 대교빌딩 옥상
108,현대자동차,37.531999,126.953751,0,100,0,서울특별시 용산구 현대자동차사옥 옥상
109,진성빌딩,37.53461,126.966177,0,100,0,서울특별시 용산구 진성빌딩 옥상
110,미성상사,37.538839,126.968402,0,100,0,서울특별시 용산구 미성상사㈜ 1층 외부
111,미성상사,37.538839,126.968402,0,100,0,서울특별시 용산구 미성상사 공장 옥상
112,조양빌딩,37.536223,126.963549,0,100,0,서울특별시 용산구 조양빌딩 옥상
113,하나실업빌딩,37.534709,126.960734,0,100,0,서울특별시 용산구 하나실업빌딩 옥상
114,오리온제과,37.535767,126.969873,0,100,0,서울특별시 용산구 오리온제과 옥상
115,오리온제과,37.536202,126.969268,0,100,0,"서울특별시 용산구 오리온제과 공장 옥상, 주차장"
116,우경빌딩,37.534231,126.961404,0,100,0,"서울특별시 용산구 우경빌딩 옥상, 1층 외부"
117,대한지방행정공제회,37.531685,126.970651,0,100,0,서울특별시 용산구 POBA 지방행정공제회 건물 1층 주차장
118,넥서스밸리,37.534144,126.964859,0,100,0,서울특별시 용산구 넥서스밸리 1층 외부
119,GS한강에끌라트,37.531399,126.955431,0,100,0,서울특별시 용산구 GS한강에끌라트 1층 외부
120,한강그랜드오피스,37.531222,126.955055,0,100,0,서울특별시 용산구 한강그랜드오피스 주차장 옆
121,용산전자오피스텔,37.532207,126.956792,0,100,0,"서울특별시 용산구 용산전자오피스텔 옥상, 건물옆"
122,NH농협은행,37.533197,126.964645,0,100,0,서울특별시 용산구 NH농협은행 용산별관(하나로마트) 옥상
123,대우아이빌,37.531695,126.968805,0,100,0,"서울특별시 용산구 대우아이빌 16층 옥상, 1층 외부"
124,유베이스,37.538001,126.967147,0,100,0,서울특별시 용산구 유베이스 1층 외부
125,대원빌딩,37.535201,126.963618,0,100,0,서울특별시 용산구 대원빌딩 1층 현관옆
126,기독교대한감리회여선교회관,37.535109,127.011499,0,100,0,서울특별시 용산구 기독교대한감리회여선교회관 1층 외부
127,일각빌딩,37.540322,126.989802,0,100,0,서울특별시 용산구 일각빌딩 5층
128,한남빌딩,37.535022,126.997224,0,100,0,서울특별시 용산구 한남빌딩 5층 외부
129,비비안,37.528894,126.964038,0,100,0,서울특별시 용산구 남영비비안 1층 외부(정자)
130,서울역 풍림아이원플러스,37.55492,126.968415,0,100,0,서울특별시 용산구 서울역 풍림 아이원플러스 공개공지
131,세광음악사,37.553965,126.965964,0,100,0,서울특별시 용산구 세광음악사 옥상
132,한화빌딩,37.552032,126.968943,0,100,0,서울특별시 용산구 한화빌딩 1층 외부
133,보은개발,37.551185,126.96922,0,100,0,서울특별시 용산구 보은개발빌딩 옥상
134,애전빌딩,37.54175,126.970388,0,100,0,서울특별시 용산구 애전빌딩 옥상
135,갈월동 오피스,37.540529,126.972721,0,100,0,서울특별시 용산구 한진중공업 빌딩 5층 외부
136,KCC IT빌딩,37.548507,126.972205,0,100,0,서울특별시 용산구 KCC IT빌딩 옥상
137,금강토탈패션할인매장,37.543561,126.971505,0,100,0,서울특별시 용산구 금강토탈패션할인매장 주차장
138,용산빌딩,37.542611,126.972137,0,100,0,서울특별시 용산구 용산빌딩 1층 외부(건물뒤편)
139,청룡빌딩,37.541424,126.972679,0,100,0,서울특별시 용산구 청룡빌딩 주차장
140,롯데지알에스,37.54154,126.971791,0,100,0,"서울특별시 용산구 롯데지알에스 옥상, 주차장"
141,서경산업,37.544739,126.973179,0,100,0,서울특별시 용산구 금강빌딩 주차장
142,수빌딩,37.532824,126.970666,0,100,0,서울특별시 용산구 수빌딩 옥상
143,우리빌딩,37.54096,126.973516,0,100,0,서울특별시 용산구 우리빌딩 주차장
144,기업은행용산지점,37.541995,126.973179,0,100,0,서울특별시 용산구 기업은행용산지점 2층 베란다
145,진흥빌딩,37.5485,126.977574,0,100,0,서울특별시 용산구 진흥빌딩 옥상
146,한치과,37.54589,126.976959,0,100,0,서울특별시 용산구 한치과의원 건물 주차장
147,㈜하나은행,37.528002,126.967632,0,100,0,서울특별시 용산구 LS용산타워 주차장
148,용산더프라임,37.540259,126.969626,0,100,0,서울특별시 용산구 용산더프라임 업무동 지하 1층
149,한국폴리텍대학,37.529136,126.996483,0,100,0,서울특별시 용산구 한국폴리텍대학 정수캠퍼스
150,한국폴리텍대학,37.52871,126.996226,0,100,0,서울특별시 용산구 한국폴리텍대학 정수캠퍼스
151,한국폴리텍대학,37.529323,126.995976,0,100,0,서울특별시 용산구 한국폴리텍대학 정수캠퍼스
152,한국폴리텍대학,37.529799,126.996498,0,100,0,서울특별시 용산구 한국폴리텍대학 정수캠퍼스
153,용산구보건소,37.527798,126.967138,0,100,0,서울특별시 용산구 한강로2가 424-5(LS타워 인근 보도)
154,용산구보건소,37.532293,126.964512,0,100,0,서울특별시 용산구 한강로3가 12-6(용산전자상가1 공영주차장 인근 보도)
155,용산구보건소,37.532324,126.964955,0,100,0,서울특별시 용산구 한강로3가 17-1(신용산지하차도 인근 보도)
156,용산구보건소,37.553105,126.97281,0,100,0,서울특별시 용산구 동자동 14-151(서울역 11번 출구 인근 보도)
